{"captureVersion":"0.1.0","captureId":"android-atlas-off-canvas-control-mutant","scenario":"off-canvas-control-mutant","application":{"packageName":"org.sightlint.fixtures.atlas","versionName":"0.1.0","versionCode":1},"runner":{"name":"sightlint-atlas-android-capture","version":"0.1.0","captureApi":"instrumentation-view-accessibility"},"build":{"fixtureSourceSha256":"sha256:4f16696318bc306910aae37c91c05d73068e9e3aa7d364bc1e03f55cce8bc9d9","gradleVersion":"8.13","androidGradlePluginVersion":"8.10.1","javaLanguageVersion":17,"compileSdk":35},"device":{"apiLevel":35,"buildFingerprint":"google\/sdk_gphone64_arm64\/emu64a:15\/AE3A.240806.043\/12960925:userdebug\/dev-keys","manufacturer":"Google","model":"sdk_gphone64_arm64","device":"emu64a","display":{"widthPixels":1080,"heightPixels":2400,"densityDpi":420,"rotationDegrees":0},"configuration":{"fontScale":1.0,"locale":"en-US","layoutDirection":"ltr","nightMode":"light"},"systemBarInsetsDevicePixels":{"left":0,"top":0,"right":0,"bottom":0}},"capture":{"order":["waitForIdle","viewAndAccessibilityHierarchy","screenshot"],"atomic":false,"animationsDisabled":true,"adbVersion":"1.0.41","emulatorVersion":"36.4.10.0","avdName":"Pixel_8","instrumentationCommand":"adb shell am instrument -w -e scenario <scenario> org.sightlint.fixtures.atlas.test\/org.sightlint.fixtures.atlas.CaptureInstrumentation","limitations":["classic Android Views only","hierarchy and screenshot are sequential, not atomic","touch delegates and rendered node identity are not captured"]},"hierarchy":{"rootResourceId":"org.sightlint.fixtures.atlas:id\/atlas_root","unidentifiedNodeCount":5,"nodes":[{"resourceId":"android:id\/action_mode_bar_stub","parentResourceId":null,"depth":2,"className":"android.view.ViewStub","layoutBoundsDevicePixels":{"x":0,"y":0,"width":0,"height":0},"identityTransform":true,"globalVisible":{"value":false,"boundsDevicePixels":null},"viewState":{"shown":false,"enabled":true,"clickable":false,"focusable":false,"focused":false,"selected":false,"checkable":false,"checked":false,"scrollable":false,"longClickable":false},"text":null,"contentDescription":null,"accessibility":{"className":"android.view.View","packageName":"org.sightlint.fixtures.atlas","viewIdResourceName":null,"geometryStatus":"exact","rawBoundsDevicePixels":{"left":0,"top":0,"right":0,"bottom":0},"boundsDevicePixels":{"x":0,"y":0,"width":0,"height":0},"actionIds":[4,8,64,16908342],"enabled":true,"clickable":false,"focusable":false,"focused":false,"selected":false,"checkable":false,"checked":false,"scrollable":false,"longClickable":false,"visibleToUser":false}},{"resourceId":"android:id\/content","parentResourceId":null,"depth":2,"className":"android.widget.FrameLayout","layoutBoundsDevicePixels":{"x":0,"y":0,"width":1080,"height":2400},"identityTransform":true,"globalVisible":{"value":true,"boundsDevicePixels":{"x":0,"y":0,"width":1080,"height":2400}},"viewState":{"shown":true,"enabled":true,"clickable":false,"focusable":false,"focused":false,"selected":false,"checkable":false,"checked":false,"scrollable":false,"longClickable":false},"text":null,"contentDescription":null,"accessibility":{"className":"android.widget.FrameLayout","packageName":"org.sightlint.fixtures.atlas","viewIdResourceName":null,"geometryStatus":"exact","rawBoundsDevicePixels":{"left":0,"top":0,"right":1080,"bottom":2400},"boundsDevicePixels":{"x":0,"y":0,"width":1080,"height":2400},"actionIds":[4,8,64,16908342],"enabled":true,"clickable":false,"focusable":false,"focused":false,"selected":false,"checkable":false,"checked":false,"scrollable":false,"longClickable":false,"visibleToUser":true}},{"resourceId":"org.sightlint.fixtures.atlas:id\/account_card","parentResourceId":"org.sightlint.fixtures.atlas:id\/atlas_root","depth":5,"className":"android.widget.LinearLayout","layoutBoundsDevicePixels":{"x":63,"y":309,"width":954,"height":273},"identityTransform":true,"globalVisible":{"value":true,"boundsDevicePixels":{"x":63,"y":309,"width":954,"height":273}},"viewState":{"shown":true,"enabled":true,"clickable":false,"focusable":false,"focused":false,"selected":false,"checkable":false,"checked":false,"scrollable":false,"longClickable":false},"text":null,"contentDescription":null,"accessibility":{"className":"android.widget.LinearLayout","packageName":"org.sightlint.fixtures.atlas","viewIdResourceName":null,"geometryStatus":"exact","rawBoundsDevicePixels":{"left":63,"top":309,"right":1017,"bottom":582},"boundsDevicePixels":{"x":63,"y":309,"width":954,"height":273},"actionIds":[4,8,64,16908342],"enabled":true,"clickable":false,"focusable":false,"focused":false,"selected":false,"checkable":false,"checked":false,"scrollable":false,"longClickable":false,"visibleToUser":true}},{"resourceId":"org.sightlint.fixtures.atlas:id\/account_name","parentResourceId":"org.sightlint.fixtures.atlas:id\/account_card","depth":7,"className":"android.widget.TextView","layoutBoundsDevicePixels":{"x":299,"y":384,"width":671,"height":63},"identityTransform":true,"globalVisible":{"value":true,"boundsDevicePixels":{"x":299,"y":384,"width":671,"height":63}},"viewState":{"shown":true,"enabled":true,"clickable":false,"focusable":false,"focused":false,"selected":false,"checkable":false,"checked":false,"scrollable":false,"longClickable":false},"text":{"utf8ByteLength":11,"sha256":"sha256:a1bb85f45a7946415e63bd81925d3c4bc3d2262a98406a2802a85cd85da1fa53"},"contentDescription":null,"accessibility":{"className":"android.widget.TextView","packageName":"org.sightlint.fixtures.atlas","viewIdResourceName":null,"geometryStatus":"exact","rawBoundsDevicePixels":{"left":299,"top":384,"right":970,"bottom":447},"boundsDevicePixels":{"x":299,"y":384,"width":671,"height":63},"actionIds":[4,8,64,256,512,131072,16908342],"enabled":true,"clickable":false,"focusable":false,"focused":false,"selected":false,"checkable":false,"checked":false,"scrollable":false,"longClickable":false,"visibleToUser":true}},{"resourceId":"org.sightlint.fixtures.atlas:id\/account_plan","parentResourceId":"org.sightlint.fixtures.atlas:id\/account_card","depth":7,"className":"android.widget.TextView","layoutBoundsDevicePixels":{"x":299,"y":458,"width":671,"height":49},"identityTransform":true,"globalVisible":{"value":true,"boundsDevicePixels":{"x":299,"y":458,"width":671,"height":49}},"viewState":{"shown":true,"enabled":true,"clickable":false,"focusable":false,"focused":false,"selected":false,"checkable":false,"checked":false,"scrollable":false,"longClickable":false},"text":{"utf8ByteLength":23,"sha256":"sha256:3924556cf926aa44c31b79c2085da39f0abd36963ed521d58c2886c4b83e60b0"},"contentDescription":null,"accessibility":{"className":"android.widget.TextView","packageName":"org.sightlint.fixtures.atlas","viewIdResourceName":null,"geometryStatus":"exact","rawBoundsDevicePixels":{"left":299,"top":458,"right":970,"bottom":507},"boundsDevicePixels":{"x":299,"y":458,"width":671,"height":49},"actionIds":[4,8,64,256,512,131072,16908342],"enabled":true,"clickable":false,"focusable":false,"focused":false,"selected":false,"checkable":false,"checked":false,"scrollable":false,"longClickable":false,"visibleToUser":true}},{"resourceId":"org.sightlint.fixtures.atlas:id\/action_region","parentResourceId":"org.sightlint.fixtures.atlas:id\/atlas_root","depth":5,"className":"android.widget.FrameLayout","layoutBoundsDevicePixels":{"x":63,"y":1105,"width":954,"height":147},"identityTransform":true,"globalVisible":{"value":true,"boundsDevicePixels":{"x":63,"y":1105,"width":954,"height":147}},"viewState":{"shown":true,"enabled":true,"clickable":false,"focusable":false,"focused":false,"selected":false,"checkable":false,"checked":false,"scrollable":false,"longClickable":false},"text":null,"contentDescription":null,"accessibility":{"className":"android.widget.FrameLayout","packageName":"org.sightlint.fixtures.atlas","viewIdResourceName":null,"geometryStatus":"exact","rawBoundsDevicePixels":{"left":63,"top":1105,"right":1017,"bottom":1252},"boundsDevicePixels":{"x":63,"y":1105,"width":954,"height":147},"actionIds":[4,8,64,16908342],"enabled":true,"clickable":false,"focusable":false,"focused":false,"selected":false,"checkable":false,"checked":false,"scrollable":false,"longClickable":false,"visibleToUser":true}},{"resourceId":"org.sightlint.fixtures.atlas:id\/atlas_root","parentResourceId":"android:id\/content","depth":3,"className":"android.widget.ScrollView","layoutBoundsDevicePixels":{"x":0,"y":0,"width":1080,"height":2400},"identityTransform":true,"globalVisible":{"value":true,"boundsDevicePixels":{"x":0,"y":0,"width":1080,"height":2400}},"viewState":{"shown":true,"enabled":true,"clickable":false,"focusable":true,"focused":false,"selected":false,"checkable":false,"checked":false,"scrollable":false,"longClickable":false},"text":null,"contentDescription":null,"accessibility":{"className":"android.widget.ScrollView","packageName":"org.sightlint.fixtures.atlas","viewIdResourceName":null,"geometryStatus":"exact","rawBoundsDevicePixels":{"left":0,"top":0,"right":1080,"bottom":2400},"boundsDevicePixels":{"x":0,"y":0,"width":1080,"height":2400},"actionIds":[1,4,8,64,16908342],"enabled":true,"clickable":false,"focusable":true,"focused":false,"selected":false,"checkable":false,"checked":false,"scrollable":false,"longClickable":false,"visibleToUser":true}},{"resourceId":"org.sightlint.fixtures.atlas:id\/avatar","parentResourceId":"org.sightlint.fixtures.atlas:id\/account_card","depth":6,"className":"android.widget.TextView","layoutBoundsDevicePixels":{"x":110,"y":372,"width":147,"height":147},"identityTransform":true,"globalVisible":{"value":true,"boundsDevicePixels":{"x":110,"y":372,"width":147,"height":147}},"viewState":{"shown":true,"enabled":true,"clickable":false,"focusable":false,"focused":false,"selected":false,"checkable":false,"checked":false,"scrollable":false,"longClickable":false},"text":{"utf8ByteLength":2,"sha256":"sha256:c8f48a68649d1cae147fb8afd54801e3e82622465c98ff1ee29075da2c201d78"},"contentDescription":{"utf8ByteLength":30,"sha256":"sha256:3c19aba81a2302